{"runId":"h10-006","phase":"6C-H10","workerId":"worker-bad-other","agentId":"a6","worktreePath":"wt","filesCreated":["src/app.ts"],"filesModified":[],"exportsProvided":["init"],"evidenceOutputs":["test.log"],"contractSatisfied":true,"knownLimitations":[],"branchResultPath":"BRANCH_RESULT.md","branchDeltaPath":"BRANCH_DELTA.json","completedAt":"2026-06-22T23:00:00+08:00"}
