{"runId":"h10-009","phase":"6C-H10","workerId":"worker-ghost-files","agentId":"a9","worktreePath":"wt","filesCreated":["src/nonexistent.ts","src/also-missing.ts"],"filesModified":[],"exportsProvided":["init"],"evidenceOutputs":["test.log"],"contractSatisfied":true,"knownLimitations":[],"branchResultPath":"BRANCH_RESULT.md","branchDeltaPath":"BRANCH_DELTA.json","completedAt":"2026-06-22T23:00:00+08:00"}
